<!ELEMENT librería (libro)+>
<!ELEMENT libro (título, autor+, ISBN, páginas, precio)>
<!ELEMENT título (#PCDATA)>
<!ELEMENT autor (#PCDATA)>
<!ELEMENT ISBN (#PCDATA)>
<!ELEMENT páginas (#PCDATA)>
<!ELEMENT precio (#PCDATA)>
